{
  "schemaVersion": 1,
  "episodeId": "BIGTEN-SEC-01",
  "sceneId": "scene-07",
  "status": "passed",
  "issuedAt": "2026-08-27T16:05:00Z",
  "manifestSha256": "02b546c1a0628b765a8d2debe4800ca0f9f29d00ad5db7a386174610f31e9ebd",
  "artifactSha256": null,
  "review": {
    "status": "approved",
    "reviewer": "Jerami",
    "reviewedAt": "2026-08-27T16:05:00Z"
  },
  "receiptId": "receipt-scene-07-figma",
  "stage": "figma-to-export",
  "previousReceiptSha256": null,
  "evidence": {
    "fileKey": "LINEUPS_FILE_KEY",
    "pageId": "428:27",
    "rootNodeId": "428:9000",
    "sourceComponentId": "428:8000",
    "episodeInstanceId": "428:9001",
    "sourceRevision": "figma-revision-current",
    "proofFrames": [
      {
        "time": 0,
        "sha256": "aaaaaaaaaaaaaaaaaaaaaaaaaaaaaaaaaaaaaaaaaaaaaaaaaaaaaaaaaaaaaaaa",
        "width": 1920,
        "height": 1080
      },
      {
        "time": 14.1,
        "sha256": "bbbbbbbbbbbbbbbbbbbbbbbbbbbbbbbbbbbbbbbbbbbbbbbbbbbbbbbbbbbbbbbb",
        "width": 1920,
        "height": 1080
      }
    ],
    "nodeType": "FRAME",
    "width": 1920,
    "height": 1080,
    "screenshotStatus": "passed",
    "motionReadbackStatus": "passed",
    "motionEngine": "figma",
    "cueSha256": "7c0914fdffdcd89b07b3bb3a8d04adc95705290ccd2bf14d39ebf20a1b63b95f"
  },
  "receiptSha256": "1cafdf4cc6f293d3b40885ba5ae717b9019316835ddc27b80f3a1b14cf40daf2"
}
