{
  "schemaVersion": 1,
  "episodeId": "BIGTEN-SEC-01",
  "sceneId": "scene-07",
  "status": "passed",
  "issuedAt": "2026-08-27T16:15:00Z",
  "manifestSha256": "02b546c1a0628b765a8d2debe4800ca0f9f29d00ad5db7a386174610f31e9ebd",
  "artifactSha256": "b7fc7ab215f83d9d4f88fabd3be6cea58c86a6fe8936bcc95a938da5d57b48f6",
  "review": {
    "status": "approved",
    "reviewer": "Jerami",
    "reviewedAt": "2026-08-27T16:05:00Z"
  },
  "receiptId": "receipt-scene-07-import",
  "stage": "premiere-import",
  "previousReceiptSha256": "6cec48ab26cb0d33f020690b71abe1c3ef33cd50236e925d9875eda8cba93644",
  "evidence": {
    "projectItemId": "project-item-scene-07",
    "treePath": "BIGTEN-SEC-01/06 Motion Renders/scene-07.mp4",
    "labelReadback": "Caribbean"
  },
  "receiptSha256": "22a2300c80cc7e2c090e7fb229cbe48144564edb26d681494805c8d3b037090d"
}
