{
  "schemaVersion": 1,
  "episodeId": "BIGTEN-SEC-01",
  "sceneId": "scene-07",
  "status": "passed",
  "issuedAt": "2026-08-27T16:10:00Z",
  "manifestSha256": "02b546c1a0628b765a8d2debe4800ca0f9f29d00ad5db7a386174610f31e9ebd",
  "artifactSha256": "b7fc7ab215f83d9d4f88fabd3be6cea58c86a6fe8936bcc95a938da5d57b48f6",
  "review": {
    "status": "approved",
    "reviewer": "Jerami",
    "reviewedAt": "2026-08-27T16:05:00Z"
  },
  "receiptId": "receipt-scene-07-export",
  "stage": "export-to-premiere",
  "previousReceiptSha256": "1cafdf4cc6f293d3b40885ba5ae717b9019316835ddc27b80f3a1b14cf40daf2",
  "evidence": {
    "exportPath": "config/lineups/fixtures/valid/render-proof.mp4",
    "fileSha256": "b7fc7ab215f83d9d4f88fabd3be6cea58c86a6fe8936bcc95a938da5d57b48f6",
    "motionProofStatus": "passed",
    "motionSampleTimes": [
      0,
      1.2,
      3.4,
      7.8,
      14.1
    ],
    "eaglePath": "Episode / 06 Motion Renders",
    "motionEngine": "figma",
    "cueSha256": "7c0914fdffdcd89b07b3bb3a8d04adc95705290ccd2bf14d39ebf20a1b63b95f",
    "sourceRevision": "figma-revision-current",
    "proofFrames": [
      {
        "time": 0,
        "sha256": "aaaaaaaaaaaaaaaaaaaaaaaaaaaaaaaaaaaaaaaaaaaaaaaaaaaaaaaaaaaaaaaa",
        "width": 1920,
        "height": 1080
      },
      {
        "time": 14.1,
        "sha256": "bbbbbbbbbbbbbbbbbbbbbbbbbbbbbbbbbbbbbbbbbbbbbbbbbbbbbbbbbbbbbbbb",
        "width": 1920,
        "height": 1080
      }
    ],
    "artifactRole": "final-premiere-render",
    "backgroundPolicy": "football-visible-baked"
  },
  "receiptSha256": "6cec48ab26cb0d33f020690b71abe1c3ef33cd50236e925d9875eda8cba93644"
}
