{
  "schemaVersion": 1,
  "episodeId": "BIGTEN-SEC-01",
  "sceneId": "scene-07",
  "status": "passed",
  "issuedAt": "2026-08-27T16:20:00Z",
  "manifestSha256": "02b546c1a0628b765a8d2debe4800ca0f9f29d00ad5db7a386174610f31e9ebd",
  "artifactSha256": "b7fc7ab215f83d9d4f88fabd3be6cea58c86a6fe8936bcc95a938da5d57b48f6",
  "review": {
    "status": "approved",
    "reviewer": "Jerami",
    "reviewedAt": "2026-08-27T16:05:00Z"
  },
  "receiptId": "receipt-scene-07-placement",
  "stage": "premiere-placement",
  "previousReceiptSha256": "22a2300c80cc7e2c090e7fb229cbe48144564edb26d681494805c8d3b037090d",
  "evidence": {
    "timelineClipId": "timeline-clip-scene-07",
    "sequenceId": "sequence-lineups-01",
    "trackIndex": 2,
    "startTime": 312.4,
    "duration": 14.2,
    "endTime": 326.6
  },
  "receiptSha256": "f7a22f00d447ea9974cd5cc51bacd39320af50e02e178a8ef325d5e0b08307a9"
}
